用户名,时间,内容,点赞量
二胡是本命,2022-07-20 03:52,如果嫁到巴基斯坦会被宠上天吗,0
谦谦君心,2022-07-22 18:41,不会,0
过嚟睇睇下姐,2022-07-17 16:13,但我没上面这个帅气,0
一拳十个嘤嘤怪__,2022-07-11 14:21,大学时跟同学去斯里兰卡玩，碰到两个巴基斯坦人一直抓着我们合影😂😂😂,0
水薄蒸雾,2022-05-19 21:08,等着疫情好了我一定要去巴基斯坦,0
月念方,2022-05-19 13:00,然后他们把合照拿回去炫耀,0
964885128,2022-05-04 14:08,我觉得还是他比较帅的原因,0
Brantkangkang,2022-04-19 03:02,你这么帅我也想合影,0
酱汁菜,2022-04-08 18:04,,0
账号已注销,2022-04-03 00:59,可以免单，但是钱要付的呀,0
请问怎么白嫖,2022-03-25 04:56,我要是去巴基斯坦说贵阳话  会不会被当做八嘎,0
鲲莉,2022-03-23 19:39,这个红衣服的挺帅呀,0
爱看电影的猫咪巧克力,2022-03-18 22:45,小哥好帅,0
LV慕容亦辰,2022-03-01 14:10,去哪里旅行拍照,0
官方认证L哦,2022-02-26 21:20,巴铁,0
污璃要努力,2022-02-26 13:34,中巴友谊长存！希望去巴基斯坦玩的国人文明友好，咱们去消费他们可能会给我们免单，但亲兄弟明算账，咱们照给不误，这样友谊会更深厚,0
嘀嗒嘀嗒嘀嗒拼车,2022-02-25 13:24,看的我热泪盈眶，作为中国人真是太自豪了,0
Sunoo_osf,2022-02-14 21:22,中巴友谊长存☀️,0
BVout,2022-02-14 17:50,如果看韩国生气到想抄家伙，来看看巴基斯坦吧，对比度就出来了,0
来个好名吧,2022-02-13 15:08,深受感动,0
晚点送它走,2022-02-13 13:06,来中国 大家也要好好的欢迎巴铁,0
双击侠,2022-02-12 08:09,中巴友谊长存。,0
马至良,2022-01-30 14:58,虽然我知道央视不差钱，但白来的硬币为什么不投呢？,0
